{
  "$schema": "https://json-schema.org/draft/2020-12/schema",
  "title": "MKE 4 Release Compatibility Matrix",
  "description": "",
  "type": "array",
  "items": {
    "type": "object",
    "properties": {
      "mkeReleaseVersion": {
        "description": "The MKE 4 minor/patch version that this entry applies to",
        "type": "string"
      },
      "k0rdentVersion": {
        "description": "K0rdent version for this MKE 4 release",
        "type": "string"
      },
      "mkeOperatorImageVersion": {
        "type": "string",
        "description": "MKE Operator Image version for this MKE 4 release"
      },
      "mkeOperatorChartVersion": {
        "type": "string",
        "description": "MKE Operator Helm Chart version for this MKE 4 release"
      },
      "k0sVersion": {
        "type": "string",
        "description": "k0s version for this MKE 4 release"
      },
      "isLatest": {
        "type": "boolean",
        "description": "Whether this is the latest MKE 4 release"
      },
      "minimumMkectlVersion": {
        "type": "string",
        "description": "Minimum mkectl version required to install this MKE 4 release"
      },
      "network": {
        "type": "object",
        "description": "Network configuration for this MKE 4 release",
        "properties": {
          "calico": {
            "type": "object",
            "description": "Calico network configuration for this MKE 4 release",
            "properties": {
              "oss": {
                "type": "object",
                "description": "Calico OSS network configuration for this MKE 4 release",
                "properties": {
                  "version": {
                    "type": "string",
                    "description": "version for Calico OSS for this MKE 4 release"
                  }
                },
                "required": ["version"]
              }
            },
            "required": ["oss"]
          }
        },
        "required": ["calico"]
      }
    },
    "required": ["mkeReleaseVersion", "k0rdentVersion", "mkeOperatorImageVersion", "mkeOperatorChartVersion", "k0sVersion", "network" ,"minimumMkectlVersion"]
  }
}