[
  {
    "mkeReleaseVersion": "v4.2.2-rc.1",
    "k0rdentVersion": "1.4.1",
    "mkeOperatorImageVersion": "v1.10.6",
    "mkeOperatorChartVersion": "3.19.55",
    "k0sVersion": "v1.35.4+k0s.0",
    "isLatest": false,
    "minimumMkectlVersion": "v4.2.2-rc.1",
    "network": {
      "calico": {
        "oss": {
          "version": "v3.31.700"
        }
      }
    }
  },
  {
    "mkeReleaseVersion": "v4.2.1",
    "k0rdentVersion": "1.4.1",
    "mkeOperatorImageVersion": "v1.10.5",
    "mkeOperatorChartVersion": "3.19.49",
    "k0sVersion": "v1.35.4+k0s.0",
    "isLatest": true,
    "minimumMkectlVersion": "v4.2.1",
    "network": {
      "calico": {
        "oss": {
          "version": "v3.31.700"
        }
      }
    }
  },
  {
    "mkeReleaseVersion": "v4.2.0",
    "k0rdentVersion": "1.3.2",
    "mkeOperatorImageVersion": "v1.7.10",
    "mkeOperatorChartVersion": "3.19.24",
    "k0sVersion": "v1.35.4+k0s.0",
    "isLatest": false,
    "minimumMkectlVersion": "v4.2.0",
    "network": {
      "calico": {
        "oss": {
          "version": "v3.31.500"
        }
      }
    }
  },
  {
    "mkeReleaseVersion": "v4.1.5",
    "k0rdentVersion": "1.2.3",
    "mkeOperatorImageVersion": "v1.6.3",
    "mkeOperatorChartVersion": "3.17.2",
    "k0sVersion": "v1.32.11+k0s.0",
    "isLatest": false,
    "minimumMkectlVersion": "v4.1.5",
    "network": {
      "calico": {
        "oss": {
          "version": "v3.30.200"
        }
      }
    }
  },
  {
    "mkeReleaseVersion": "v4.1.3",
    "k0rdentVersion": "1.2.3",
    "mkeOperatorImageVersion": "v1.6.1",
    "mkeOperatorChartVersion": "3.17.1",
    "k0sVersion": "v1.32.11+k0s.0",
    "isLatest": false,
    "minimumMkectlVersion": "v4.1.3",
    "network": {
      "calico": {
        "oss": {
          "version": "v3.30.200"
        }
      }
    }
  },
  {
    "mkeReleaseVersion": "v4.1.2",
    "k0rdentVersion": "1.1.0",
    "mkeOperatorImageVersion": "v1.4.15",
    "mkeOperatorChartVersion": "3.11.2",
    "k0sVersion": "v1.32.6+k0s.0",
    "isLatest": false,
    "minimumMkectlVersion": "v4.1.2",
    "network": {
      "calico": {
        "oss": {
          "version": "v3.30.200"
        }
      }
    }
  },
  {
    "mkeReleaseVersion": "v4.1.1",
    "k0rdentVersion": "1.1.0",
    "mkeOperatorImageVersion": "v1.4.5",
    "mkeOperatorChartVersion": "3.4.1",
    "k0sVersion": "v1.32.6+k0s.0",
    "isLatest": false,
    "minimumMkectlVersion": "v4.1.1",
    "network": {
      "calico": {
        "oss": {
          "version": "v3.30.200"
        }
      }
    }
  },
  {
    "mkeReleaseVersion": "v4.1.0",
    "k0rdentVersion": "0.2.0-alpha4",
    "mkeOperatorImageVersion": "v1.3.0",
    "mkeOperatorChartVersion": "1.0.0",
    "calicoOSSVersion": "v3.29.3",
    "k0sVersion": "v1.32.3+k0s.0",
    "isLatest": false,
    "minimumMkectlVersion": "v4.1.0",
    "network": {
      "calico": {
        "oss": {
          "version": "v3.29.3"
        }
      }
    }
  }
]
